{
  "schemaVersion": "1.0.0",
  "generatedOn": "2026-10-27",
  "loadCount": 3,
  "source": {
    "name": "Community Berger 6 mm 115 Grain VLD Target",
    "url": "https://github.com/kevinlchristianson/Ballistic-Comparison-App/blob/main/data/loads/inputs/2026-10-27-berger-vld-target-6mm-115gr.csv",
    "retrievedOn": "2026-10-27",
    "testBarrelIn": null
  },
  "loads": [
    {
      "cartridge": "6mm Creedmoor",
      "bulletDiameterIn": null,
      "bulletWeightGr": 115,
      "bulletDescription": "115 VLD Target",
      "bulletManufacturer": "Berger",
      "bulletSku": null,
      "powder": "H4350",
      "charge": 38.5,
      "chargeUnit": "gr",
      "chargeLevel": "other",
      "compressed": null,
      "primer": null,
      "case": null,
      "coal": 2.895,
      "coalUnit": "in",
      "barrelLength": 26,
      "barrelLengthUnit": "in",
      "barrelLengthOrigin": "row",
      "velocity": 2945,
      "velocityUnit": "fps",
      "pressure": null,
      "pressureUnit": null,
      "pressureMethod": null,
      "sourceUrl": "https://forum.accurateshooter.com/threads/range-results-115-berger-vld-mm-creedmoor.4042383/",
      "sourcePage": "Shooters' Forum",
      "notes": "Community-reported anecdotal load, not a published manufacturer load; Author: Ironworker; Posted: Jul 23, 2021; Same 115 berger VLD and 26 in Bartlein. Seating 2.895. SD 8.2. Three-eighths MOA. He wrote H4350 for the charge and H4359 once when comparing SD. Filed as VLD Target because the post is about a PRS load choice."
    },
    {
      "cartridge": "6mm Creedmoor",
      "bulletDiameterIn": null,
      "bulletWeightGr": 115,
      "bulletDescription": "115 VLD Target",
      "bulletManufacturer": "Berger",
      "bulletSku": null,
      "powder": "RE#26",
      "charge": 44.2,
      "chargeUnit": "gr",
      "chargeLevel": "other",
      "compressed": null,
      "primer": null,
      "case": null,
      "coal": 2.908,
      "coalUnit": "in",
      "barrelLength": 26,
      "barrelLengthUnit": "in",
      "barrelLengthOrigin": "row",
      "velocity": 3135,
      "velocityUnit": "fps",
      "pressure": null,
      "pressureUnit": null,
      "pressureMethod": null,
      "sourceUrl": "https://forum.accurateshooter.com/threads/range-results-115-berger-vld-mm-creedmoor.4042383/",
      "sourcePage": "Shooters' Forum",
      "notes": "Community-reported anecdotal load, not a published manufacturer load; Author: Ironworker; Posted: Jul 23, 2021; 115 berger VLD. Seating 2.908. 26 in Bartlein 7.5 twist. SD 18. Half MOA. He did not name the cartridge. The thread is 6mm Creedmoor. Filed as VLD Target because he said this comparison is for PRS shooting."
    },
    {
      "cartridge": "6mm Creedmoor",
      "bulletDiameterIn": null,
      "bulletWeightGr": 115,
      "bulletDescription": "115 VLD Target",
      "bulletManufacturer": "Berger",
      "bulletSku": null,
      "powder": "RL 16",
      "charge": null,
      "chargeUnit": null,
      "chargeLevel": null,
      "compressed": null,
      "primer": null,
      "case": null,
      "coal": null,
      "coalUnit": null,
      "barrelLength": null,
      "barrelLengthUnit": null,
      "barrelLengthOrigin": null,
      "velocity": null,
      "velocityUnit": null,
      "pressure": null,
      "pressureUnit": null,
      "pressureMethod": null,
      "sourceUrl": "https://forum.accurateshooter.com/threads/range-results-115-berger-vld-mm-creedmoor.4042383/",
      "sourcePage": "Shooters' Forum",
      "notes": "Community-reported anecdotal load, not a published manufacturer load; Author: MTlager; Posted: Jul 24, 2021; Charge_gr: 38.6 to 39; Velocity_fps: around 3000; The 115s. He did not name the cartridge. The thread is 6mm Creedmoor. Filed as VLD Target because he shoots this load in 1000 yard benchrest."
    }
  ]
}
