{
  "schemaVersion": "1.0.0",
  "generatedOn": "2026-10-27",
  "loadCount": 3,
  "source": {
    "name": "Community Berger 30 Caliber 210 Grain VLD Target",
    "url": "https://github.com/kevinlchristianson/Ballistic-Comparison-App/blob/main/data/loads/inputs/2026-10-27-berger-vld-target-30cal-210gr.csv",
    "retrievedOn": "2026-10-27",
    "testBarrelIn": null
  },
  "loads": [
    {
      "cartridge": ".308",
      "bulletDiameterIn": null,
      "bulletWeightGr": 210,
      "bulletDescription": "210 VLD Target",
      "bulletManufacturer": "Berger",
      "bulletSku": null,
      "powder": "Varget",
      "charge": 41.2,
      "chargeUnit": "gr",
      "chargeLevel": "other",
      "compressed": null,
      "primer": null,
      "case": null,
      "coal": null,
      "coalUnit": null,
      "barrelLength": null,
      "barrelLengthUnit": null,
      "barrelLengthOrigin": null,
      "velocity": 2425,
      "velocityUnit": "fps",
      "pressure": null,
      "pressureUnit": null,
      "pressureMethod": null,
      "sourceUrl": "https://forum.accurateshooter.com/threads/308-win-210-vld-loads-anyone.3851564/",
      "sourcePage": "Shooters' Forum",
      "notes": "Community-reported anecdotal load, not a published manufacturer load; Author: X-Caveman Line not stated in post; also filed under VLD Hunting/Target."
    },
    {
      "cartridge": "300 WSM",
      "bulletDiameterIn": null,
      "bulletWeightGr": 210,
      "bulletDescription": "210 VLD Target",
      "bulletManufacturer": "Berger",
      "bulletSku": null,
      "powder": "H4350",
      "charge": null,
      "chargeUnit": null,
      "chargeLevel": null,
      "compressed": null,
      "primer": null,
      "case": null,
      "coal": null,
      "coalUnit": null,
      "barrelLength": 30,
      "barrelLengthUnit": "in",
      "barrelLengthOrigin": "row",
      "velocity": null,
      "velocityUnit": null,
      "pressure": null,
      "pressureUnit": null,
      "pressureMethod": null,
      "sourceUrl": "https://forum.accurateshooter.com/threads/300-wsm-velocities.3907904/",
      "sourcePage": "Shooters' Forum",
      "notes": "Community-reported anecdotal load, not a published manufacturer load; Author: WAMBO; Posted: Aug 19, 2016; Charge_gr: 60.5 to 61; Velocity_fps: 2820-2840; Line not stated in post; also filed under VLD Hunting/Target."
    },
    {
      "cartridge": "300 wby",
      "bulletDiameterIn": null,
      "bulletWeightGr": 210,
      "bulletDescription": "210 VLD Target",
      "bulletManufacturer": "Berger",
      "bulletSku": null,
      "powder": "RL 25",
      "charge": null,
      "chargeUnit": null,
      "chargeLevel": null,
      "compressed": null,
      "primer": null,
      "case": null,
      "coal": null,
      "coalUnit": null,
      "barrelLength": null,
      "barrelLengthUnit": null,
      "barrelLengthOrigin": null,
      "velocity": null,
      "velocityUnit": null,
      "pressure": null,
      "pressureUnit": null,
      "pressureMethod": null,
      "sourceUrl": "https://forum.accurateshooter.com/threads/300-weatherby-and-berger-210-vld-load-info.3794217/",
      "sourcePage": "Shooters' Forum",
      "notes": "Community-reported anecdotal load, not a published manufacturer load; Author: 4xforfun; Posted: Sep 4, 2012; Charge_gr: 73 to 83; Line not stated in post; also filed under VLD Hunting/Target. Match barrels."
    }
  ]
}
