{
  "schemaVersion": "1.0.0",
  "generatedOn": "2026-10-27",
  "loadCount": 2,
  "source": {
    "name": "Community Berger 7 mm 150 Grain Classic Hunter",
    "url": "https://github.com/kevinlchristianson/Ballistic-Comparison-App/blob/main/data/loads/inputs/2026-10-27-berger-classic-hunter-7mm-150gr.csv",
    "retrievedOn": "2026-10-27",
    "testBarrelIn": null
  },
  "loads": [
    {
      "cartridge": "7 mm mag",
      "bulletDiameterIn": null,
      "bulletWeightGr": 150,
      "bulletDescription": "150 Classic Hunter",
      "bulletManufacturer": "Berger",
      "bulletSku": null,
      "powder": "rl 26",
      "charge": 65,
      "chargeUnit": "gr",
      "chargeLevel": "other",
      "compressed": null,
      "primer": null,
      "case": null,
      "coal": null,
      "coalUnit": null,
      "barrelLength": null,
      "barrelLengthUnit": null,
      "barrelLengthOrigin": null,
      "velocity": null,
      "velocityUnit": null,
      "pressure": null,
      "pressureUnit": null,
      "pressureMethod": null,
      "sourceUrl": "https://forum.accurateshooter.com/threads/7-mm-mag.4110706/page-2",
      "sourcePage": "Shooters' Forum",
      "notes": "Community-reported anecdotal load, not a published manufacturer load; Author: bowboss; Posted: Dec 8, 2023; 150gr berger classic hunter. Groups from a ragged hole to 1/2 in. He did not name the cartridge; the thread is kochie's 7 mm mag, and he said he has the exact same rifle."
    },
    {
      "cartridge": "7WSM",
      "bulletDiameterIn": null,
      "bulletWeightGr": 150,
      "bulletDescription": "150 Classic Hunter",
      "bulletManufacturer": "Berger",
      "bulletSku": null,
      "powder": "Reloder 23",
      "charge": 67.6,
      "chargeUnit": "gr",
      "chargeLevel": "other",
      "compressed": null,
      "primer": "Gm210M",
      "case": "Winchester",
      "coal": 2.825,
      "coalUnit": "in",
      "barrelLength": 25,
      "barrelLengthUnit": "in",
      "barrelLengthOrigin": "row",
      "velocity": 3237,
      "velocityUnit": "fps",
      "pressure": null,
      "pressureUnit": null,
      "pressureMethod": null,
      "sourceUrl": "https://www.longrangeonly.com/forum/threads/7wsm-cartridge-guide-data-collection.9201/",
      "sourcePage": "Long Range Only",
      "notes": "Community-reported anecdotal load, not a published manufacturer load; Author: Yoteklr; Posted: Mar 7, 2021; 150gr Berger Classic Hunter, HBN plated. 102% load density. Jump .025. 6 ES, 2 SD typical. 25 in 9 twist Bartlein #3b, SAAMI zero freebore. Shot at 200 yards from a hunting bag. Brass is on the 5th firing. Short action Savage 11. He did not name the cartridge; the thread is the 7WSM cartridge guide."
    }
  ]
}
