{
  "schemaVersion": "1.0.0",
  "generatedOn": "2026-10-27",
  "loadCount": 4,
  "source": {
    "name": "Community Berger 22 Caliber 52 Grain FB Varmint",
    "url": "https://github.com/kevinlchristianson/Ballistic-Comparison-App/blob/main/data/loads/inputs/2026-10-27-berger-varmint-22cal-52gr.csv",
    "retrievedOn": "2026-10-27",
    "testBarrelIn": null
  },
  "loads": [
    {
      "cartridge": "222",
      "bulletDiameterIn": null,
      "bulletWeightGr": 52,
      "bulletDescription": "52 FB Varmint",
      "bulletManufacturer": "Berger",
      "bulletSku": null,
      "powder": "H-4198",
      "charge": 20.0,
      "chargeUnit": "gr",
      "chargeLevel": "other",
      "compressed": null,
      "primer": "Br-4",
      "case": "Lapua",
      "coal": null,
      "coalUnit": null,
      "barrelLength": null,
      "barrelLengthUnit": null,
      "barrelLengthOrigin": null,
      "velocity": null,
      "velocityUnit": null,
      "pressure": null,
      "pressureUnit": null,
      "pressureMethod": null,
      "sourceUrl": "https://forum.accurateshooter.com/threads/222-rem-with-52-fb-berger-varmint.3865795/",
      "sourcePage": "Shooters' Forum",
      "notes": "Community-reported anecdotal load, not a published manufacturer load; Author: Drop Port; Posted: Nov 14, 2015; 52 Berger FB Varmint. He wrote .05 in, which is not a measured COAL. 3 shots in the high .2s. He did not name the cartridge; the thread is 222 Rem."
    },
    {
      "cartridge": "222",
      "bulletDiameterIn": null,
      "bulletWeightGr": 52,
      "bulletDescription": "52 FB Varmint",
      "bulletManufacturer": "Berger",
      "bulletSku": null,
      "powder": "H-4198",
      "charge": 20.5,
      "chargeUnit": "gr",
      "chargeLevel": "other",
      "compressed": null,
      "primer": "Br-4",
      "case": "Lapua",
      "coal": null,
      "coalUnit": null,
      "barrelLength": null,
      "barrelLengthUnit": null,
      "barrelLengthOrigin": null,
      "velocity": null,
      "velocityUnit": null,
      "pressure": null,
      "pressureUnit": null,
      "pressureMethod": null,
      "sourceUrl": "https://forum.accurateshooter.com/threads/222-rem-with-52-fb-berger-varmint.3865795/",
      "sourcePage": "Shooters' Forum",
      "notes": "Community-reported anecdotal load, not a published manufacturer load; Author: Drop Port; Posted: Nov 14, 2015; 52 Berger FB Varmint. He wrote .05 in, which is not a measured COAL. 3 shots in the high 1s. He did not name the cartridge; the thread is 222 Rem."
    },
    {
      "cartridge": "222",
      "bulletDiameterIn": null,
      "bulletWeightGr": 52,
      "bulletDescription": "52 FB Varmint",
      "bulletManufacturer": "Berger",
      "bulletSku": null,
      "powder": "H-4198",
      "charge": 21.0,
      "chargeUnit": "gr",
      "chargeLevel": "other",
      "compressed": null,
      "primer": "Br-4",
      "case": "Lapua",
      "coal": null,
      "coalUnit": null,
      "barrelLength": null,
      "barrelLengthUnit": null,
      "barrelLengthOrigin": null,
      "velocity": null,
      "velocityUnit": null,
      "pressure": null,
      "pressureUnit": null,
      "pressureMethod": null,
      "sourceUrl": "https://forum.accurateshooter.com/threads/222-rem-with-52-fb-berger-varmint.3865795/",
      "sourcePage": "Shooters' Forum",
      "notes": "Community-reported anecdotal load, not a published manufacturer load; Author: Drop Port; Posted: Nov 14, 2015; 52 Berger FB Varmint. He wrote .05 in, which is not a measured COAL. 5 shots in the high 3s. He did not name the cartridge; the thread is 222 Rem."
    },
    {
      "cartridge": "222",
      "bulletDiameterIn": null,
      "bulletWeightGr": 52,
      "bulletDescription": "52 FB Varmint",
      "bulletManufacturer": "Berger",
      "bulletSku": null,
      "powder": "IMR 4198",
      "charge": 21,
      "chargeUnit": "gr",
      "chargeLevel": "other",
      "compressed": null,
      "primer": null,
      "case": null,
      "coal": null,
      "coalUnit": null,
      "barrelLength": null,
      "barrelLengthUnit": null,
      "barrelLengthOrigin": null,
      "velocity": 3300,
      "velocityUnit": "fps",
      "pressure": null,
      "pressureUnit": null,
      "pressureMethod": null,
      "sourceUrl": "https://forum.accurateshooter.com/threads/222-rem-with-52-fb-berger-varmint.3865795/",
      "sourcePage": "Shooters' Forum",
      "notes": "Community-reported anecdotal load, not a published manufacturer load; Author: mshelton; Posted: Feb 9, 2015; 52 FB Berger Varmint in his Sako Vixen. He barely jumps them and did not give a measured jump. No pressure signs. He did not name the cartridge; the thread is 222 Rem."
    }
  ]
}
