{
  "schemaVersion": "1.0.0",
  "generatedOn": "2026-10-27",
  "loadCount": 8,
  "source": {
    "name": "Community Berger 338 Caliber 300 Grain Hybrid OTM Tactical",
    "url": "https://github.com/kevinlchristianson/Ballistic-Comparison-App/blob/main/data/loads/inputs/2026-10-27-berger-otm-tactical-338cal-300gr.csv",
    "retrievedOn": "2026-10-27",
    "testBarrelIn": null
  },
  "loads": [
    {
      "cartridge": "338 Edges",
      "bulletDiameterIn": null,
      "bulletWeightGr": 300,
      "bulletDescription": "300 Hybrid OTM",
      "bulletManufacturer": "Berger",
      "bulletSku": null,
      "powder": "H-1000",
      "charge": 90.4,
      "chargeUnit": "gr",
      "chargeLevel": "other",
      "compressed": null,
      "primer": null,
      "case": null,
      "coal": null,
      "coalUnit": null,
      "barrelLength": 29,
      "barrelLengthUnit": "in",
      "barrelLengthOrigin": "row",
      "velocity": 2849,
      "velocityUnit": "fps",
      "pressure": null,
      "pressureUnit": null,
      "pressureMethod": null,
      "sourceUrl": "https://www.longrangeonly.com/forum/threads/338-edge-loads.8122/",
      "sourcePage": "Long Range Only",
      "notes": "Community-reported anecdotal load, not a published manufacturer load; Author: RUM MAN; Posted: Dec 19, 2020; 300 gr. Otm. 15 thou off. Remington action, 29 in Kreiger heavy Palma. Three in one hole at 100 yards. He wrote 338 Edges."
    },
    {
      "cartridge": "338 Lapua Mag",
      "bulletDiameterIn": null,
      "bulletWeightGr": 300,
      "bulletDescription": "300 Hybrid OTM",
      "bulletManufacturer": "Berger",
      "bulletSku": null,
      "powder": "RL33",
      "charge": 97.5,
      "chargeUnit": "gr",
      "chargeLevel": "other",
      "compressed": null,
      "primer": "215m",
      "case": "Norma",
      "coal": null,
      "coalUnit": null,
      "barrelLength": 30,
      "barrelLengthUnit": "in",
      "barrelLengthOrigin": "row",
      "velocity": null,
      "velocityUnit": null,
      "pressure": null,
      "pressureUnit": null,
      "pressureMethod": null,
      "sourceUrl": "https://www.longrangeonly.com/forum/threads/any-results-on-a-tip-300-grain-in-338-lapua-mag.7560/",
      "sourcePage": "Long Range Only",
      "notes": "Community-reported anecdotal load, not a published manufacturer load; Author: ABC1000; Posted: May 19, 2020; Velocity_fps: 2,890-2,910; Berger 300 OTM Hybrids. Jumping .030. A hair of pressure. Just over 2,900 fps, and later 2,890-2,910 ish while the barrel was speeding up. MOA or better at 1,000 yards. He did not name the cartridge; the thread is 338 Lapua Mag."
    },
    {
      "cartridge": "Edge",
      "bulletDiameterIn": null,
      "bulletWeightGr": 300,
      "bulletDescription": "300 Hybrid OTM",
      "bulletManufacturer": "Berger",
      "bulletSku": null,
      "powder": "N570",
      "charge": 92,
      "chargeUnit": "gr",
      "chargeLevel": "other",
      "compressed": null,
      "primer": "Fed gm215m",
      "case": null,
      "coal": null,
      "coalUnit": null,
      "barrelLength": null,
      "barrelLengthUnit": null,
      "barrelLengthOrigin": null,
      "velocity": null,
      "velocityUnit": null,
      "pressure": null,
      "pressureUnit": null,
      "pressureMethod": null,
      "sourceUrl": "https://www.longrangeonly.com/forum/threads/n570-in-standard-338-edge.1021/",
      "sourcePage": "Long Range Only",
      "notes": "Community-reported anecdotal load, not a published manufacturer load; Author: EdgeFan; Posted: Aug 30, 2014; 300gr OTM. Seated at 3.228 CBTO on a Hornady comparator, .015 off the lands. CBTO is not COAL. He said 93 gr looked like the sweet spot. At 94 gr the primers started to flatten and the group went to hell. He wrote my new edge. The thread is a standard 338 Edge."
    },
    {
      "cartridge": "Edge",
      "bulletDiameterIn": null,
      "bulletWeightGr": 300,
      "bulletDescription": "300 Hybrid OTM",
      "bulletManufacturer": "Berger",
      "bulletSku": null,
      "powder": "N570",
      "charge": 93,
      "chargeUnit": "gr",
      "chargeLevel": "other",
      "compressed": null,
      "primer": "Fed gm215m",
      "case": null,
      "coal": null,
      "coalUnit": null,
      "barrelLength": null,
      "barrelLengthUnit": null,
      "barrelLengthOrigin": null,
      "velocity": null,
      "velocityUnit": null,
      "pressure": null,
      "pressureUnit": null,
      "pressureMethod": null,
      "sourceUrl": "https://www.longrangeonly.com/forum/threads/n570-in-standard-338-edge.1021/",
      "sourcePage": "Long Range Only",
      "notes": "Community-reported anecdotal load, not a published manufacturer load; Author: EdgeFan; Posted: Aug 30, 2014; 300gr OTM. Seated at 3.228 CBTO on a Hornady comparator, .015 off the lands. CBTO is not COAL. He said 93 gr looked like the sweet spot. At 94 gr the primers started to flatten and the group went to hell. He wrote my new edge. The thread is a standard 338 Edge."
    },
    {
      "cartridge": "Edge",
      "bulletDiameterIn": null,
      "bulletWeightGr": 300,
      "bulletDescription": "300 Hybrid OTM",
      "bulletManufacturer": "Berger",
      "bulletSku": null,
      "powder": "N570",
      "charge": 94,
      "chargeUnit": "gr",
      "chargeLevel": "other",
      "compressed": null,
      "primer": "Fed gm215m",
      "case": null,
      "coal": null,
      "coalUnit": null,
      "barrelLength": null,
      "barrelLengthUnit": null,
      "barrelLengthOrigin": null,
      "velocity": null,
      "velocityUnit": null,
      "pressure": null,
      "pressureUnit": null,
      "pressureMethod": null,
      "sourceUrl": "https://www.longrangeonly.com/forum/threads/n570-in-standard-338-edge.1021/",
      "sourcePage": "Long Range Only",
      "notes": "Community-reported anecdotal load, not a published manufacturer load; Author: EdgeFan; Posted: Aug 30, 2014; 300gr OTM. Seated at 3.228 CBTO on a Hornady comparator, .015 off the lands. CBTO is not COAL. He said 93 gr looked like the sweet spot. At 94 gr the primers started to flatten and the group went to hell. He wrote my new edge. The thread is a standard 338 Edge."
    },
    {
      "cartridge": "Edge",
      "bulletDiameterIn": null,
      "bulletWeightGr": 300,
      "bulletDescription": "300 Hybrid OTM",
      "bulletManufacturer": "Berger",
      "bulletSku": null,
      "powder": "Reloader 33",
      "charge": 102,
      "chargeUnit": "gr",
      "chargeLevel": "other",
      "compressed": null,
      "primer": "CCI 250",
      "case": "Remington",
      "coal": null,
      "coalUnit": null,
      "barrelLength": 30,
      "barrelLengthUnit": "in",
      "barrelLengthOrigin": "row",
      "velocity": null,
      "velocityUnit": null,
      "pressure": null,
      "pressureUnit": null,
      "pressureMethod": null,
      "sourceUrl": "https://www.longrangeonly.com/forum/threads/n570-in-standard-338-edge.1021/",
      "sourcePage": "Long Range Only",
      "notes": "Community-reported anecdotal load, not a published manufacturer load; Author: mabia; Posted: Aug 26, 2014; Velocity_fps: around 3020; 300 gr Berger OTM. Base to ogive 3.065 is not COAL. 30 in Bartlein 1 in 9.5. MagnetoSpeed. He said a standard Edge. He signed the post Randy."
    },
    {
      "cartridge": "Edge",
      "bulletDiameterIn": null,
      "bulletWeightGr": 300,
      "bulletDescription": "300 Hybrid OTM",
      "bulletManufacturer": "Berger",
      "bulletSku": null,
      "powder": "Reloader 33",
      "charge": 103,
      "chargeUnit": "gr",
      "chargeLevel": "other",
      "compressed": null,
      "primer": "CCI 250",
      "case": "Remington",
      "coal": null,
      "coalUnit": null,
      "barrelLength": 30,
      "barrelLengthUnit": "in",
      "barrelLengthOrigin": "row",
      "velocity": 3060,
      "velocityUnit": "fps",
      "pressure": null,
      "pressureUnit": null,
      "pressureMethod": null,
      "sourceUrl": "https://www.longrangeonly.com/forum/threads/n570-in-standard-338-edge.1021/",
      "sourcePage": "Long Range Only",
      "notes": "Community-reported anecdotal load, not a published manufacturer load; Author: mabia; Posted: Aug 26, 2014; Same Edge and bullet as the 102 gr load. Cooler weather. A few primer pockets in warmer weather. MagnetoSpeed."
    },
    {
      "cartridge": "Standard edge",
      "bulletDiameterIn": null,
      "bulletWeightGr": 300,
      "bulletDescription": "300 Hybrid OTM",
      "bulletManufacturer": "Berger",
      "bulletSku": null,
      "powder": "RL 33",
      "charge": 108,
      "chargeUnit": "gr",
      "chargeLevel": "other",
      "compressed": null,
      "primer": null,
      "case": "Remington",
      "coal": null,
      "coalUnit": null,
      "barrelLength": 28,
      "barrelLengthUnit": "in",
      "barrelLengthOrigin": "row",
      "velocity": 3010,
      "velocityUnit": "fps",
      "pressure": null,
      "pressureUnit": null,
      "pressureMethod": null,
      "sourceUrl": "https://www.longrangeonly.com/forum/threads/338-edge-loads.8122/",
      "sourcePage": "Long Range Only",
      "notes": "Community-reported anecdotal load, not a published manufacturer load; Author: Boscodog; Posted: Sep 28, 2020; 300 otm. Standard edge, 28 in Bartlein. He signed the post Tom. H1000 reached 2800 fps and hammered the brass, with no charge given for that powder."
    }
  ]
}
