{
  "schemaVersion": "1.0.0",
  "generatedOn": "2026-10-27",
  "loadCount": 3,
  "source": {
    "name": "Community Sierra 6 mm 95 Grain HPBT MatchKing",
    "url": "https://github.com/kevinlchristianson/Ballistic-Comparison-App/blob/main/data/loads/inputs/2026-10-27-sierra-smk-6mm-95gr.csv",
    "retrievedOn": "2026-10-27",
    "testBarrelIn": null
  },
  "loads": [
    {
      "cartridge": "6BR",
      "bulletDiameterIn": null,
      "bulletWeightGr": 95,
      "bulletDescription": "95 HPBT MatchKing",
      "bulletManufacturer": "Sierra",
      "bulletSku": null,
      "powder": "Varget",
      "charge": 31.5,
      "chargeUnit": "gr",
      "chargeLevel": "other",
      "compressed": null,
      "primer": null,
      "case": null,
      "coal": null,
      "coalUnit": null,
      "barrelLength": null,
      "barrelLengthUnit": null,
      "barrelLengthOrigin": null,
      "velocity": null,
      "velocityUnit": null,
      "pressure": null,
      "pressureUnit": null,
      "pressureMethod": null,
      "sourceUrl": "https://forum.accurateshooter.com/threads/95smks.3760836/",
      "sourcePage": "Shooters' Forum",
      "notes": "Community-reported anecdotal load, not a published manufacturer load; Author: fdshuster; Posted: Feb 28, 2011; 95 gr. SMK. He wrote part 1437. His standard load. His 30 gr of Varget is the 107 SMK, not this bullet."
    },
    {
      "cartridge": "6BR",
      "bulletDiameterIn": null,
      "bulletWeightGr": 95,
      "bulletDescription": "95 HPBT MatchKing",
      "bulletManufacturer": "Sierra",
      "bulletSku": null,
      "powder": "Varget",
      "charge": 32.1,
      "chargeUnit": "gr",
      "chargeLevel": "other",
      "compressed": null,
      "primer": null,
      "case": null,
      "coal": null,
      "coalUnit": null,
      "barrelLength": null,
      "barrelLengthUnit": null,
      "barrelLengthOrigin": null,
      "velocity": null,
      "velocityUnit": null,
      "pressure": null,
      "pressureUnit": null,
      "pressureMethod": null,
      "sourceUrl": "https://forum.accurateshooter.com/threads/anyone-use-the-95g-smk.4117723/",
      "sourcePage": "Shooters' Forum",
      "notes": "Community-reported anecdotal load, not a published manufacturer load; Author: 7x57; Posted: Mar 10, 2024; The 95s in a standard 6BR. He does not know the velocity. Shot X's at 600 yards."
    },
    {
      "cartridge": "6br",
      "bulletDiameterIn": null,
      "bulletWeightGr": 95,
      "bulletDescription": "95 HPBT MatchKing",
      "bulletManufacturer": "Sierra",
      "bulletSku": null,
      "powder": "varget",
      "charge": 31,
      "chargeUnit": "gr",
      "chargeLevel": "other",
      "compressed": null,
      "primer": null,
      "case": null,
      "coal": null,
      "coalUnit": null,
      "barrelLength": null,
      "barrelLengthUnit": null,
      "barrelLengthOrigin": null,
      "velocity": null,
      "velocityUnit": null,
      "pressure": null,
      "pressureUnit": null,
      "pressureMethod": null,
      "sourceUrl": "https://forum.accurateshooter.com/threads/95smks.3760836/",
      "sourcePage": "Shooters' Forum",
      "notes": "Community-reported anecdotal load, not a published manufacturer load; Author: jacksaligari; Posted: Feb 28, 2011; 95smk. Started at 31 gr and got 8 to 10 in of vertical at 550 and 1000 yards."
    }
  ]
}
