{
  "schemaVersion": "1.0.0",
  "generatedOn": "2026-10-27",
  "loadCount": 5,
  "source": {
    "name": "Community Berger 30 Caliber 217 Grain Elite Hunter",
    "url": "https://github.com/kevinlchristianson/Ballistic-Comparison-App/blob/main/data/loads/inputs/2026-10-27-berger-elite-hunter-30cal-217gr.csv",
    "retrievedOn": "2026-10-27",
    "testBarrelIn": null
  },
  "loads": [
    {
      "cartridge": "300 PRC",
      "bulletDiameterIn": null,
      "bulletWeightGr": 217,
      "bulletDescription": "217 Elite Hunter",
      "bulletManufacturer": "Berger",
      "bulletSku": null,
      "powder": "H4831SC",
      "charge": 76.0,
      "chargeUnit": "gr",
      "chargeLevel": "other",
      "compressed": null,
      "primer": null,
      "case": null,
      "coal": 2.654,
      "coalUnit": "in",
      "barrelLength": null,
      "barrelLengthUnit": null,
      "barrelLengthOrigin": null,
      "velocity": null,
      "velocityUnit": null,
      "pressure": null,
      "pressureUnit": null,
      "pressureMethod": null,
      "sourceUrl": "https://www.longrangeonly.com/forum/threads/217-berger.16786/",
      "sourcePage": "Long Range Only",
      "notes": "Community-reported anecdotal load, not a published manufacturer load; Author: Ladd; Posted: Apr 10, 2026; Primer Fed 210m. Printed COAL 2.654. Gunwerks Nexus 300 PRC. Five-shot group at 100 yards. He first wrote 72 gr and edited the post to 76.0 gr H4831SC. He forgot the Garmin, so there is no chronograph reading. A guess of mid to upper 2800s is not stored. The 215 gr groups in the same test are a different bullet."
    },
    {
      "cartridge": "300 PRC",
      "bulletDiameterIn": null,
      "bulletWeightGr": 217,
      "bulletDescription": "217 Elite Hunter",
      "bulletManufacturer": "Berger",
      "bulletSku": null,
      "powder": "H4831SC",
      "charge": 76.0,
      "chargeUnit": "gr",
      "chargeLevel": "other",
      "compressed": null,
      "primer": null,
      "case": null,
      "coal": 2.654,
      "coalUnit": "in",
      "barrelLength": null,
      "barrelLengthUnit": null,
      "barrelLengthOrigin": null,
      "velocity": null,
      "velocityUnit": null,
      "pressure": null,
      "pressureUnit": null,
      "pressureMethod": null,
      "sourceUrl": "https://www.longrangeonly.com/forum/threads/217-berger.16786/",
      "sourcePage": "Long Range Only",
      "notes": "Community-reported anecdotal load, not a published manufacturer load; Author: Ladd; Posted: Apr 10, 2026; Primer CCI BR2. He said the rifle liked this group best. Printed COAL 2.654. Gunwerks Nexus 300 PRC. Five-shot group at 100 yards. He first wrote 72 gr and edited the post to 76.0 gr H4831SC. He forgot the Garmin, so there is no chronograph reading. A guess of mid to upper 2800s is not stored. The 215 gr groups in the same test are a different bullet."
    },
    {
      "cartridge": "300 PRC",
      "bulletDiameterIn": null,
      "bulletWeightGr": 217,
      "bulletDescription": "217 Elite Hunter",
      "bulletManufacturer": "Berger",
      "bulletSku": null,
      "powder": "H4831SC",
      "charge": 75.8,
      "chargeUnit": "gr",
      "chargeLevel": "other",
      "compressed": null,
      "primer": "CCI BR2",
      "case": "Lapua",
      "coal": 3.66,
      "coalUnit": "in",
      "barrelLength": 24,
      "barrelLengthUnit": "in",
      "barrelLengthOrigin": "row",
      "velocity": 2972,
      "velocityUnit": "fps",
      "pressure": null,
      "pressureUnit": null,
      "pressureMethod": null,
      "sourceUrl": "https://www.longrangeonly.com/forum/threads/300-prc-cartridge-guide-data-collection.7254/page-3",
      "sourcePage": "Long Range Only",
      "notes": "Community-reported anecdotal load, not a published manufacturer load; Author: Ladd; Posted: Oct 7, 2026; Gunwerks Nexus 24 in barrel. Fired Lapua brass. Neck tension .003. This is the chrono post, separate from the 76.0 gr group test."
    },
    {
      "cartridge": "300PRC",
      "bulletDiameterIn": null,
      "bulletWeightGr": 217,
      "bulletDescription": "217 Elite Hunter",
      "bulletManufacturer": "Berger",
      "bulletSku": null,
      "powder": "H1000",
      "charge": 77.8,
      "chargeUnit": "gr",
      "chargeLevel": "other",
      "compressed": null,
      "primer": "Fed 215",
      "case": "Peterson",
      "coal": null,
      "coalUnit": null,
      "barrelLength": 24,
      "barrelLengthUnit": "in",
      "barrelLengthOrigin": "row",
      "velocity": 2938.2,
      "velocityUnit": "fps",
      "pressure": null,
      "pressureUnit": null,
      "pressureMethod": null,
      "sourceUrl": "https://rokslide.com/forums/threads/berger-elite-hunter-217-for-300-prc.447855/",
      "sourcePage": "Rokslide",
      "notes": "Community-reported anecdotal load, not a published manufacturer load; Author: Drew050811; Posted: Apr 12, 2026; Alamo Precision. .033 off the lands. Average muzzle velocity, SD 8.2. 1-9 twist. He wrote Berger .217."
    },
    {
      "cartridge": "300wm",
      "bulletDiameterIn": null,
      "bulletWeightGr": 217,
      "bulletDescription": "217 Elite Hunter",
      "bulletManufacturer": "Berger",
      "bulletSku": null,
      "powder": "N570",
      "charge": null,
      "chargeUnit": null,
      "chargeLevel": null,
      "compressed": null,
      "primer": null,
      "case": "Peterson",
      "coal": 3.7,
      "coalUnit": "in",
      "barrelLength": 26,
      "barrelLengthUnit": "in",
      "barrelLengthOrigin": "row",
      "velocity": null,
      "velocityUnit": null,
      "pressure": null,
      "pressureUnit": null,
      "pressureMethod": null,
      "sourceUrl": "https://www.longrangeonly.com/forum/threads/300-win-mag-217-bergers-any-favorites.17553/",
      "sourcePage": "Long Range Only",
      "notes": "Community-reported anecdotal load, not a published manufacturer load; Author: not shown in the page fetch; Posted: date not shown; Charge_gr: around 77; 26 in Proof. Node in Peterson brass. No velocity posted. Berger gave him a start, and that manufacturer table was not copied. A suggested 74 gr H1000 start in the same thread was advice, not a fired load."
    }
  ]
}
