{
  "schemaVersion": "1.0.0",
  "generatedOn": "2026-10-27",
  "loadCount": 9,
  "source": {
    "name": "Community Berger 338 Caliber 250 Grain Elite Hunter",
    "url": "https://github.com/kevinlchristianson/Ballistic-Comparison-App/blob/main/data/loads/inputs/2026-10-27-berger-elite-hunter-338cal-250gr.csv",
    "retrievedOn": "2026-10-27",
    "testBarrelIn": null
  },
  "loads": [
    {
      "cartridge": "33 Nosler",
      "bulletDiameterIn": null,
      "bulletWeightGr": 250,
      "bulletDescription": "250 Elite Hunter",
      "bulletManufacturer": "Berger",
      "bulletSku": null,
      "powder": null,
      "charge": null,
      "chargeUnit": null,
      "chargeLevel": null,
      "compressed": null,
      "primer": null,
      "case": null,
      "coal": 3.567,
      "coalUnit": "in",
      "barrelLength": 26,
      "barrelLengthUnit": "in",
      "barrelLengthOrigin": "row",
      "velocity": 2850,
      "velocityUnit": "fps",
      "pressure": null,
      "pressureUnit": null,
      "pressureMethod": null,
      "sourceUrl": "https://rokslide.com/forums/threads/which-338.153100/",
      "sourcePage": "Rokslide",
      "notes": "Community-reported anecdotal load, not a published manufacturer load; Author: Rusty85; Posted: Dec 21, 2019; Trued 700. Could go hotter but accuracy fell off. No powder named. He also calls the rifle My 33."
    },
    {
      "cartridge": "338 Edge",
      "bulletDiameterIn": null,
      "bulletWeightGr": 250,
      "bulletDescription": "250 grn Elite Hunter",
      "bulletManufacturer": "Berger",
      "bulletSku": null,
      "powder": "N570",
      "charge": 97.0,
      "chargeUnit": "gr",
      "chargeLevel": "other",
      "compressed": null,
      "primer": null,
      "case": null,
      "coal": null,
      "coalUnit": null,
      "barrelLength": null,
      "barrelLengthUnit": null,
      "barrelLengthOrigin": null,
      "velocity": null,
      "velocityUnit": null,
      "pressure": null,
      "pressureUnit": null,
      "pressureMethod": null,
      "sourceUrl": "https://www.longrangeonly.com/forum/threads/338-edge.14373/",
      "sourcePage": "Long Range Only",
      "notes": "Community-reported anecdotal load, not a published manufacturer load; Author: Triple BB; Posted: Nov 7, 2023; Where he is at with N570. No velocity posted."
    },
    {
      "cartridge": "338 Edge",
      "bulletDiameterIn": null,
      "bulletWeightGr": 250,
      "bulletDescription": "250 grn Elite Hunter",
      "bulletManufacturer": "Berger",
      "bulletSku": null,
      "powder": "N570",
      "charge": 100,
      "chargeUnit": "gr",
      "chargeLevel": "other",
      "compressed": null,
      "primer": null,
      "case": null,
      "coal": null,
      "coalUnit": null,
      "barrelLength": null,
      "barrelLengthUnit": null,
      "barrelLengthOrigin": null,
      "velocity": null,
      "velocityUnit": null,
      "pressure": null,
      "pressureUnit": null,
      "pressureMethod": null,
      "sourceUrl": "https://www.longrangeonly.com/forum/threads/338-edge.14373/",
      "sourcePage": "Long Range Only",
      "notes": "Community-reported anecdotal load, not a published manufacturer load; Author: Triple BB; Posted: Nov 7, 2023; Took it to 100 grns without pressure signs, but accuracy fell off with the increased velocity. No velocity posted. No steps between 97.0 and 100 were printed."
    },
    {
      "cartridge": "338 rum",
      "bulletDiameterIn": null,
      "bulletWeightGr": 250,
      "bulletDescription": "250 grain berger elite hunter",
      "bulletManufacturer": "Berger",
      "bulletSku": null,
      "powder": "H-1000",
      "charge": null,
      "chargeUnit": null,
      "chargeLevel": null,
      "compressed": null,
      "primer": null,
      "case": null,
      "coal": null,
      "coalUnit": null,
      "barrelLength": null,
      "barrelLengthUnit": null,
      "barrelLengthOrigin": null,
      "velocity": null,
      "velocityUnit": null,
      "pressure": null,
      "pressureUnit": null,
      "pressureMethod": null,
      "sourceUrl": "https://www.longrangeonly.com/forum/threads/338-rum.4032/",
      "sourcePage": "Long Range Only",
      "notes": "Community-reported anecdotal load, not a published manufacturer load; Author: HARPERC; Posted: Jan 6, 2018; Charge_gr: about 98; Velocity_fps: just over 2900; All maximum loads, work up to it. He likes the H-1000 best."
    },
    {
      "cartridge": "338 rum",
      "bulletDiameterIn": null,
      "bulletWeightGr": 250,
      "bulletDescription": "250 grain berger elite hunter",
      "bulletManufacturer": "Berger",
      "bulletSku": null,
      "powder": "RL-22",
      "charge": null,
      "chargeUnit": null,
      "chargeLevel": null,
      "compressed": null,
      "primer": null,
      "case": null,
      "coal": null,
      "coalUnit": null,
      "barrelLength": null,
      "barrelLengthUnit": null,
      "barrelLengthOrigin": null,
      "velocity": null,
      "velocityUnit": null,
      "pressure": null,
      "pressureUnit": null,
      "pressureMethod": null,
      "sourceUrl": "https://www.longrangeonly.com/forum/threads/338-rum.4032/",
      "sourcePage": "Long Range Only",
      "notes": "Community-reported anecdotal load, not a published manufacturer load; Author: HARPERC; Posted: Jan 6, 2018; Charge_gr: about 89; All maximum loads, work up to it. He no longer uses RL-22 for the 250 grain loads."
    },
    {
      "cartridge": "338 rum",
      "bulletDiameterIn": null,
      "bulletWeightGr": 250,
      "bulletDescription": "250 grain berger elite hunter",
      "bulletManufacturer": "Berger",
      "bulletSku": null,
      "powder": "RL-25",
      "charge": null,
      "chargeUnit": null,
      "chargeLevel": null,
      "compressed": null,
      "primer": null,
      "case": null,
      "coal": null,
      "coalUnit": null,
      "barrelLength": null,
      "barrelLengthUnit": null,
      "barrelLengthOrigin": null,
      "velocity": null,
      "velocityUnit": null,
      "pressure": null,
      "pressureUnit": null,
      "pressureMethod": null,
      "sourceUrl": "https://www.longrangeonly.com/forum/threads/338-rum.4032/",
      "sourcePage": "Long Range Only",
      "notes": "Community-reported anecdotal load, not a published manufacturer load; Author: HARPERC; Posted: Jan 6, 2018; Charge_gr: about 95; All maximum loads, work up to it. Partner likes the RL-25."
    },
    {
      "cartridge": "338 rum",
      "bulletDiameterIn": null,
      "bulletWeightGr": 250,
      "bulletDescription": "250 grain berger elite hunter",
      "bulletManufacturer": "Berger",
      "bulletSku": null,
      "powder": "RL26",
      "charge": null,
      "chargeUnit": null,
      "chargeLevel": null,
      "compressed": null,
      "primer": null,
      "case": null,
      "coal": null,
      "coalUnit": null,
      "barrelLength": null,
      "barrelLengthUnit": null,
      "barrelLengthOrigin": null,
      "velocity": null,
      "velocityUnit": null,
      "pressure": null,
      "pressureUnit": null,
      "pressureMethod": null,
      "sourceUrl": "https://www.longrangeonly.com/forum/threads/338-rum.4032/",
      "sourcePage": "Long Range Only",
      "notes": "Community-reported anecdotal load, not a published manufacturer load; Author: Brentc; Posted: Jan 6, 2018; Charge_gr: 89-90; Velocity_fps: around 3025; Depending on barrel length. No barrel length named. A separate sentence that Retumbo will work has no charge or velocity and is not a row."
    },
    {
      "cartridge": "338-375 Ruger",
      "bulletDiameterIn": null,
      "bulletWeightGr": 250,
      "bulletDescription": "250gr Elite Hunter",
      "bulletManufacturer": "Berger",
      "bulletSku": null,
      "powder": null,
      "charge": null,
      "chargeUnit": null,
      "chargeLevel": null,
      "compressed": null,
      "primer": null,
      "case": null,
      "coal": null,
      "coalUnit": null,
      "barrelLength": null,
      "barrelLengthUnit": null,
      "barrelLengthOrigin": null,
      "velocity": 2900,
      "velocityUnit": "fps",
      "pressure": null,
      "pressureUnit": null,
      "pressureMethod": null,
      "sourceUrl": "https://forum.accurateshooter.com/threads/338-win-mag-bullet-choice-for-elk.3915052/",
      "sourcePage": "Shooters' Forum",
      "notes": "Community-reported anecdotal load, not a published manufacturer load; Author: Ledd Slinger; Posted: Dec 11, 2016; Muzzle velocity. One-shot elk at 311 yards. No powder or charge named."
    },
    {
      "cartridge": "338wm",
      "bulletDiameterIn": null,
      "bulletWeightGr": 250,
      "bulletDescription": "250 grn Elite Hunter",
      "bulletManufacturer": "Berger",
      "bulletSku": null,
      "powder": null,
      "charge": null,
      "chargeUnit": null,
      "chargeLevel": null,
      "compressed": null,
      "primer": null,
      "case": null,
      "coal": null,
      "coalUnit": null,
      "barrelLength": null,
      "barrelLengthUnit": null,
      "barrelLengthOrigin": null,
      "velocity": 2780,
      "velocityUnit": "fps",
      "pressure": null,
      "pressureUnit": null,
      "pressureMethod": null,
      "sourceUrl": "https://www.longrangeonly.com/forum/threads/250-grain-berger-elite-hunter.6325/",
      "sourcePage": "Long Range Only",
      "notes": "Community-reported anecdotal load, not a published manufacturer load; Author: scottrod338; Posted: Aug 29, 2019; Deer between 100 and 300 yards. Did not check the hollow point. No powder or charge named."
    }
  ]
}
