{
  "schemaVersion": "1.0.0",
  "generatedOn": "2026-10-27",
  "loadCount": 3,
  "source": {
    "name": "Community Berger 22 Caliber 77 Grain OTM Tactical",
    "url": "https://github.com/kevinlchristianson/Ballistic-Comparison-App/blob/main/data/loads/inputs/2026-10-27-berger-otm-tactical-22cal-77gr.csv",
    "retrievedOn": "2026-10-27",
    "testBarrelIn": null
  },
  "loads": [
    {
      "cartridge": ".223",
      "bulletDiameterIn": null,
      "bulletWeightGr": 77,
      "bulletDescription": "77 OTM Tactical",
      "bulletManufacturer": "Berger",
      "bulletSku": null,
      "powder": null,
      "charge": null,
      "chargeUnit": null,
      "chargeLevel": null,
      "compressed": null,
      "primer": null,
      "case": null,
      "coal": null,
      "coalUnit": null,
      "barrelLength": null,
      "barrelLengthUnit": null,
      "barrelLengthOrigin": null,
      "velocity": null,
      "velocityUnit": null,
      "pressure": null,
      "pressureUnit": null,
      "pressureMethod": null,
      "sourceUrl": "https://forum.accurateshooter.com/threads/n140-for-223-bolt-rifle.4118501/",
      "sourcePage": "Shooters' Forum",
      "notes": "Community-reported anecdotal load, not a published manufacturer load; Author: LVLAaron; Posted: Feb 26, 2024; Charge_gr: 24.6-7; Berger 77 OTM's at magazine length. He did not name the powder or the cartridge. The thread is N140 for a .223 bolt rifle, and he said this charge is a real treat and to work somewhere around there."
    },
    {
      "cartridge": "223 cal",
      "bulletDiameterIn": null,
      "bulletWeightGr": 77,
      "bulletDescription": "77 OTM Tactical",
      "bulletManufacturer": "Berger",
      "bulletSku": null,
      "powder": "N140",
      "charge": null,
      "chargeUnit": null,
      "chargeLevel": null,
      "compressed": null,
      "primer": null,
      "case": null,
      "coal": null,
      "coalUnit": null,
      "barrelLength": null,
      "barrelLengthUnit": null,
      "barrelLengthOrigin": null,
      "velocity": null,
      "velocityUnit": null,
      "pressure": null,
      "pressureUnit": null,
      "pressureMethod": null,
      "sourceUrl": "https://forum.accurateshooter.com/threads/question-on-berger-77-gr-otm-tactical-bullets.4102169/",
      "sourcePage": "Shooters' Forum",
      "notes": "Community-reported anecdotal load, not a published manufacturer load; Author: Cfshooter; Posted: Aug 18, 2023; Charge_gr: 23.7 to 24.5; 77 OTM. The printed span is the workup he shot, not one settled charge. He did not name the cartridge; the thread asked about 223 cal."
    },
    {
      "cartridge": "223 cal",
      "bulletDiameterIn": null,
      "bulletWeightGr": 77,
      "bulletDescription": "77 OTM Tactical",
      "bulletManufacturer": "Berger",
      "bulletSku": null,
      "powder": "varget",
      "charge": 23.5,
      "chargeUnit": "gr",
      "chargeLevel": "other",
      "compressed": null,
      "primer": null,
      "case": null,
      "coal": null,
      "coalUnit": null,
      "barrelLength": null,
      "barrelLengthUnit": null,
      "barrelLengthOrigin": null,
      "velocity": null,
      "velocityUnit": null,
      "pressure": null,
      "pressureUnit": null,
      "pressureMethod": null,
      "sourceUrl": "https://forum.accurateshooter.com/threads/question-on-berger-77-gr-otm-tactical-bullets.4102169/",
      "sourcePage": "Shooters' Forum",
      "notes": "Community-reported anecdotal load, not a published manufacturer load; Author: dstoenner; Posted: Aug 18, 2023; He wrote 77's in the Berger 77 gr OTM Tactical thread. Magazine length. Groups hold about .6, the X ring on an MR31 target. He did not name the cartridge; the thread asked about 223 cal."
    }
  ]
}
