{
  "schemaVersion": "1.0.0",
  "generatedOn": "2026-10-27",
  "loadCount": 4,
  "source": {
    "name": "Community Berger 30 Caliber 185 Grain VLD Hunting",
    "url": "https://github.com/kevinlchristianson/Ballistic-Comparison-App/blob/main/data/loads/inputs/2026-10-27-berger-vld-hunting-30cal-185gr.csv",
    "retrievedOn": "2026-10-27",
    "testBarrelIn": null
  },
  "loads": [
    {
      "cartridge": ".308",
      "bulletDiameterIn": null,
      "bulletWeightGr": 185,
      "bulletDescription": "185 VLD Hunting",
      "bulletManufacturer": "Berger",
      "bulletSku": null,
      "powder": "Varget",
      "charge": 43,
      "chargeUnit": "gr",
      "chargeLevel": "other",
      "compressed": null,
      "primer": null,
      "case": null,
      "coal": null,
      "coalUnit": null,
      "barrelLength": 32,
      "barrelLengthUnit": "in",
      "barrelLengthOrigin": "row",
      "velocity": 2690,
      "velocityUnit": "fps",
      "pressure": null,
      "pressureUnit": null,
      "pressureMethod": null,
      "sourceUrl": "https://forum.accurateshooter.com/threads/308-berger-185-vld.3834842/",
      "sourcePage": "Shooters' Forum",
      "notes": "Community-reported anecdotal load, not a published manufacturer load; Author: watercam; Posted: Jan 21, 2014; Line not stated in post; also filed under VLD Hunting/Target. Cartridge not named in the post; the thread is .308 Berger 185 VLD. 32 in Bartlein. .020 jump, which is not COAL."
    },
    {
      "cartridge": ".308",
      "bulletDiameterIn": null,
      "bulletWeightGr": 185,
      "bulletDescription": "185 VLD Hunting",
      "bulletManufacturer": "Berger",
      "bulletSku": null,
      "powder": "Varget",
      "charge": 44.5,
      "chargeUnit": "gr",
      "chargeLevel": "other",
      "compressed": null,
      "primer": null,
      "case": null,
      "coal": null,
      "coalUnit": null,
      "barrelLength": 32,
      "barrelLengthUnit": "in",
      "barrelLengthOrigin": "row",
      "velocity": null,
      "velocityUnit": null,
      "pressure": null,
      "pressureUnit": null,
      "pressureMethod": null,
      "sourceUrl": "https://forum.accurateshooter.com/threads/308-berger-185-vld.3834842/",
      "sourcePage": "Shooters' Forum",
      "notes": "Community-reported anecdotal load, not a published manufacturer load; Author: watercam; Posted: Jan 21, 2014; Velocity_fps: about 2730; Line not stated in post; also filed under VLD Hunting/Target. Cartridge not named in the post; the thread is .308 Berger 185 VLD. 32 in Bartlein. .020 jump, which is not COAL."
    },
    {
      "cartridge": "300 WSM",
      "bulletDiameterIn": null,
      "bulletWeightGr": 185,
      "bulletDescription": "185 VLD Hunting",
      "bulletManufacturer": "Berger",
      "bulletSku": null,
      "powder": "H4350",
      "charge": 63.5,
      "chargeUnit": "gr",
      "chargeLevel": "other",
      "compressed": null,
      "primer": null,
      "case": null,
      "coal": null,
      "coalUnit": null,
      "barrelLength": null,
      "barrelLengthUnit": null,
      "barrelLengthOrigin": null,
      "velocity": null,
      "velocityUnit": null,
      "pressure": null,
      "pressureUnit": null,
      "pressureMethod": null,
      "sourceUrl": "https://forum.accurateshooter.com/threads/300-wsm-180-berger-powder-choice.4187371/",
      "sourcePage": "Shooters' Forum",
      "notes": "Community-reported anecdotal load, not a published manufacturer load; Author: FeMan; Posted: Sep 15, 2026; 185 Huntng VLDs. He did not name the cartridge; the thread is 300 WSM. On Sep 29 he said a customer's 300WSM did not like H4350, so this 63.5 gr load is his own."
    },
    {
      "cartridge": "300 WSM",
      "bulletDiameterIn": null,
      "bulletWeightGr": 185,
      "bulletDescription": "185 VLD Hunting",
      "bulletManufacturer": "Berger",
      "bulletSku": null,
      "powder": "rl16",
      "charge": 65.5,
      "chargeUnit": "gr",
      "chargeLevel": "other",
      "compressed": null,
      "primer": null,
      "case": null,
      "coal": null,
      "coalUnit": null,
      "barrelLength": null,
      "barrelLengthUnit": null,
      "barrelLengthOrigin": null,
      "velocity": null,
      "velocityUnit": null,
      "pressure": null,
      "pressureUnit": null,
      "pressureMethod": null,
      "sourceUrl": "https://forum.accurateshooter.com/threads/300-wsm-180-berger-powder-choice.4187371/",
      "sourcePage": "Shooters' Forum",
      "notes": "Community-reported anecdotal load, not a published manufacturer load; Author: Alex Wheeler; Posted: Sep 15, 2026; Line not stated in post; also filed under VLD Hunting/Target. No line named."
    }
  ]
}
